inside amazon go,nytimes
material intro view android showcase library,github
when the world is led by a child,nytimes
remarkable tablet open source tools and hacks,github
parsl   parallel scripting library for python,github
show hn  strict interfaces in ruby,github
how your face can have a profound impact on how others perceive you,nytimes
forget apps  carbyn has built a html5 os,techcrunch
show hn  tests.sh   func unit testing command line tools and daemons,github
show hn  self-hosted standup bot for discord,github
walmart and rakuten partner on grocery delivery in japan  e-books in u.s,techcrunch
statistical modeling examples  python stan statsmodels ,github
after  gravity  alfonso cuar n went home to make  roma ,nytimes
how to encrypt your facebook messages,techcrunch
adds karma support to brunch,github
google s marissa mayer tapped as yahoo s chief,nytimes
amiga 2000 revision 6.2 motherboard re-done in kicad,github
adam coates  director of baidu s silicon valley ai lab  leaves baidu,techcrunch
show hn  ipfs-deploy   zero-config cli to deploy static websites to ipfs,github
dns over https   publicly available servers,github
thrifty  thrift for android  from microsoft,github
how c and objective-c declarations are translated to swift,github
vocabs  command line dictionary. now a pypi package,github
guice extension to automatically install annotated modules  1.0.0 released,github
how high school ruined leisure,nytimes
open policy agent v0.29.1 released,github
hello world in every computer language,github
u.s. plans to require banks to identify owners of shell companies,nytimes
getting started with python plugins   jenkinsci jenkins.py wiki,github
show hn  simple readability index scorer,github
the squeeze continues  venture fundraising shrinks 82 percent in second quarter,techcrunch
url.js   a lightweight javascript library to manipulate the page url,github
google releases branding guidelines for glass,techcrunch
small tool i wrote to check for leaked passwords. feedback appreciated,github
px4 px4-autopilot  px4 autopilot software,github
d.n.a. backs lore on pre-columbian dogs,nytimes
 resource not found  groupkey  randomly appears,github
another forloop chapter  call for speakers,github
a guide to sharing data with analysts to maximize turnaround,github
fast shuts doors after slow growth  high burn precluded fundraising options,techcrunch
symbian toys  rompatcher  is open-source now,github
detroit businesswomen team up to get rape kits tested,nytimes
how new york gets its water,nytimes
an async and dynamic orm in rust,github
show hn  optimize the box filter operation on arm divices step by step,github
pi-crust - a tiny breakout board for raspberry pi.,github
evolving-snakes  snakes from the classic game evolve using a genetic algorithm,github
the coder and the dictator,nytimes
intuit to buy credit karma for $7.1b in cash and stock,techcrunch
pg simple  simple wrapper for python psycopg2 with conn pooling,github
boston red sox used apple watches to steal signs against yankees,nytimes
birthday parties as virus vector,nytimes
path - $30m  round of funding  incl sir richard branson ,techcrunch
chia blockchain,github
reselect  selector library for redux,github
goodbye  hedge fund  hello  touch revolution,nytimes
show hn  scanning the web for security.txt files,github
balancing debt against college choice,nytimes
dataframe  a pure c   pandas equivalent,github
the central park five,nytimes
code repository for implementing how to use redux with reasonml,github
a list of remote mob programming sessions you can attend for free,github
you love your iphone. literally.,nytimes
google buzz two weeks later,techcrunch
young  healthy people are getting sick from covid-19,nytimes
chroma.js   a javascript library for color conversions and color scales,github
when a unicorn startup stumbles  its employees get hurt,nytimes
once nearly invisible to search engines  flash files can now be found and indexed,techcrunch
colourful visualization tool for binary files,github
 ebook  an introduction to libuv,github
tab completion using fzf in zsh  bash  gnu readline apps,github
certificate ripper released   tool to extract server certificates,github
wintersmith - an awesome node.js based static page generator,github
microsoft s greek headquarters attacked by arsonists,techcrunch
undocumented x86 instructions to control the cpu at the microarchitecture level  pdf ,github
deepspeech   a tensorflow implementation of baidu s deepspeech architecture,github
should parents of kids with severe disabilities be allowed to stop their growth ,nytimes
new startups pitch in berlin at hackfwd build event  tctv ,techcrunch
show hn  find the safest well lit walking route between two locations,github
show hn  permify   granular access control under 30mins in go powered by opa,github
athena-os  an arch linux-based distro focused on cybersecurity,github
show hn  csprng for integers  javascript ,github
a physicist of online groceries,nytimes
memeo connect makes gdrive a reality,techcrunch
games industry transitions in 2013  will consoles and windows rise again ,techcrunch
next generation of e-ink kindle to sport new front-lit screen,techcrunch
open source public chat web application on github,github
becoming a web engineer,github
self-driving tesla was involved in fatal crash  u.s. says,nytimes
fortran 77 function call tree generator,github
monzo raises $69m series g,techcrunch
watch the airbus project vahana prototype autonomous air taxi take flight,techcrunch
descartes labs raises $30m for geospatial analytics,techcrunch
google drive cli interface,github
uber settles class-action suit over safety background checks,nytimes
qemu incremental backup using dirty-bitmaps,github
show hn  open source flutter login animation,github
forum  email and newsgroups the sensible way  using hash trees,github
show hn  hubstore   showcase your python desktop applications,github
meta axes head of global community development embroiled in underage sex sting,techcrunch
gatling  a hydra-enabled gpu path tracer that supports materialx,github
how long am i php free   an important power tool written in rust,github
miami says it can adapt to rising seas. not everyone is convinced,nytimes
leap motion plays its final hand,techcrunch
the second screen is booming as 45  often always use devices while watching tv,techcrunch
require webpack modules server-side,github
thyme  automatically track which applications you use and for how long,github
lies  damned lies  and the  telegraph  2013 ,nytimes
dronedeploy raises $20m series b,techcrunch
bentoml  the easiest way to build machine learning apis,github
angular 6 universal kit with angular-cli  ssr and hmr on browser server sides,github
go  don t add generics to go s core libraries in 1.18,github
as buzz sounds more like crickets  does google need to be more patient ,techcrunch
coinbase is investigating claims of insider trading from its bitcoin cash launch,techcrunch
zerocoolos  live usb stick that plays the film  hackers  on a continuous loop,github
t-mobile stops counting netflix hbo hulu  other video streams against data usage,techcrunch
ruby ansi taoup fortunes,github
show hn  track upcoming meetups  with meetup.com ,github
is the answer to phone addiction a worse phone ,nytimes
a list of attacks on bitcoin and crypto assets in the meatspace,github
show hn  acrobot   keep track of your company acronyms  github.com ,github
the big business of being gwyneth paltrow,nytimes
fiksu s new service lets developers track apple watch apps,techcrunch
india to revise enforcement of internet law,nytimes
tabswitcher   increase your productivity in google chrome,github
what we re fighting for,nytimes
google clarifies their h.264 stance,techcrunch
heroku polyglot roadmap may 2010 by adam wiggins,github
elm style json decoder for typescript  type safety compile- and run-time,github
automattic acquires simperium,techcrunch
mojo vision s ar contact lenses are cool  but many questions remain,techcrunch
show hn  codernews,github
india is investigating google over alleged android abuse,techcrunch
will the russians hack germany  too ,nytimes
trillian  transparent highly scalable and cryptographically verifiable datastore,github
spectrum   an audio visualization implementation on gpu,github
react with less,github
as museums get on tiktok  the uffizi is an unlikely class clown,nytimes
